{
  "schema_version": 1,
  "work_item_id": "EMB-001",
  "title": "SPI driver timeout investigation",
  "type": "defect",
  "priority": "P1",
  "requester": "product-team",
  "owner": "embedded-team",
  "project_id": "pilot",
  "product_id": "device-a",
  "target_platform": "linux-embedded",
  "target_board": "board-rev-a",
  "target_os": "linux",
  "repo_roots": ["firmware/main"],
  "base_branch_or_commit": "main",
  "goal": "Identify and fix the SPI timeout without widening the change scope.",
  "non_goals": ["Redesign unrelated drivers"],
  "current_behavior": "Intermittent transfer timeout under stress.",
  "expected_behavior": "No timeout in the declared stress test.",
  "acceptance_criteria": ["Cross-build passes", "Target stress test completes without timeout"],
  "constraints": ["No production device write without approval"],
  "interfaces": ["SPI"],
  "knowledge_refs": [],
  "required_verification": {"host": "optional", "cross_build": "required", "sil": "optional", "hil": "required", "release": "not_applicable"},
  "allowed_actions": ["A0_READ", "A1_ANALYZE", "A2_GENERATE", "A3_MODIFY_WORKTREE", "A4_BUILD_TEST"],
  "forbidden_actions": ["production_ota", "otp_fuse"],
  "approval_policy": "Device write requires human approval.",
  "blocker_policy": "Stop if repo/base/device identity cannot be confirmed."
}
