{
  "schema_version": 1,
  "work_item_id": "EXAMPLE-EMB-001",
  "title": "UBIFS abnormal read-only investigation",
  "type": "defect",
  "priority": "P1",
  "requester": "embedded-team",
  "owner": "embedded-team",
  "project_id": "core-reference-example",
  "product_id": "example-device",
  "target_platform": "linux-embedded",
  "target_board": "example-board-rev-a",
  "target_os": "linux",
  "repo_roots": ["firmware/main"],
  "base_branch_or_commit": "1111111111111111111111111111111111111111",
  "goal": "Identify and fix the verified cause of the UBIFS read-only transition without hiding real media errors.",
  "non_goals": ["Redesign the production partition layout", "Replace flash without evidence"],
  "current_behavior": "Under the declared write stress, the filesystem can remount read-only after an I/O error chain.",
  "expected_behavior": "The original reproducible condition no longer causes a false read-only transition and true uncorrectable errors remain visible.",
  "acceptance_criteria": ["Cross-build passes", "Target reproduction completes without false read-only transition", "True uncorrectable ECC negative case remains fail-closed"],
  "constraints": ["No production device write", "Keep the change scoped to the confirmed error-mapping path"],
  "interfaces": ["SPI-NAND", "MTD", "UBI", "UBIFS"],
  "knowledge_refs": [],
  "required_verification": {"host": "optional", "cross_build": "required", "sil": "optional", "hil": "required", "release": "not_applicable"},
  "allowed_actions": ["A0_READ", "A1_ANALYZE", "A2_GENERATE", "A3_MODIFY_WORKTREE", "A4_BUILD_TEST"],
  "forbidden_actions": ["production_ota", "otp_fuse"],
  "approval_policy": "Any target device write requires explicit human approval.",
  "blocker_policy": "Stop if source, board, firmware or device identity cannot be confirmed."
}
